<?xml version="1.0" encoding="utf-8"?>
<time_table xmlns:xsi="http://www.w3.org/2001/XMLSchema-instance"
			xsi:noNamespaceSchemaLocation="lab-3-3.xsd">
	<lesson no="1">
		<date>2017-06-08</date>
		<time>12:18:00</time>
	</lesson>
	<lesson no="2">
		<date>2017-06-08</date>
		<time>14:18:00</time>
	</lesson>
	<offices>
		<office code="БК">
			<name>комплекс "Бакунский"</name>
			<address>ул. Баккуaнская, 17</address>
		</office>
		<office code="РА">
			<name>комплекс "Радио"</name>
			<address>ул. Радио, д. 222</address>
		</office>
	</offices>
</time_table>